{
  "$schema": "http://json-schema.org/draft-07/schema#",
  "$id": "https://rjp.local/protocol/schemas/assessment_artifact.schema.json",
  "title": "AssessmentArtifact",
  "type": "object",
  "additionalProperties": false,
  "required": [
    "schema_version",
    "case_id",
    "subject_id",
    "domain_id",
    "domain_spec_hash",
    "parent_revision_hash",
    "evidence_root",
    "evaluation_spec_hash",
    "model_policy_hash",
    "outcome_enum",
    "confidence_ppm",
    "outcome_payload",
    "outcome_payload_hash",
    "evaluated_at"
  ],
  "properties": {
    "schema_version": {
      "const": "rjp.assessment_artifact.v1"
    },
    "case_id": {
      "type": "string",
      "minLength": 1
    },
    "subject_id": {
      "type": "string",
      "pattern": "^0x[a-f0-9]{40}$"
    },
    "domain_id": {
      "type": "string",
      "minLength": 1
    },
    "domain_spec_hash": {
      "type": "string",
      "pattern": "^0x[a-f0-9]{64}$"
    },
    "parent_revision_hash": {
      "type": [
        "string",
        "null"
      ],
      "pattern": "^0x[a-f0-9]{64}$"
    },
    "evidence_root": {
      "type": "string",
      "pattern": "^0x[a-f0-9]{64}$"
    },
    "evaluation_spec_hash": {
      "type": "string",
      "pattern": "^0x[a-f0-9]{64}$"
    },
    "model_policy_hash": {
      "type": "string",
      "pattern": "^0x[a-f0-9]{64}$"
    },
    "outcome_enum": {
      "type": "string",
      "minLength": 1
    },
    "confidence_ppm": {
      "type": "integer",
      "minimum": 0,
      "maximum": 1000000
    },
    "outcome_payload": {
      "type": "object"
    },
    "outcome_payload_hash": {
      "type": "string",
      "pattern": "^0x[a-f0-9]{64}$"
    },
    "evaluated_at": {
      "type": "string",
      "pattern": "^\\d{4}-\\d{2}-\\d{2}T\\d{2}:\\d{2}:\\d{2}Z$"
    }
  }
}
